{
  "$schema": "http://json-schema.org/draft-04/schema#",
  "id": "https://project-open-data.cio.gov/v1.1/schema/catalog.json#",
  "title": "Project Open Data Catalog",
  "description": "Validates an entire collection of Project Open Data metadata JSON objects. Agencies produce said collections in the form of Data.json files.",
  "type": "object",
  "dependencies": {
    "@type": [
      "@context"
    ]
  },
  "required": [
    "conformsTo",
    "dataset"
  ],
  "properties": {
    "@context": {
      "title": "Metadata Context",
      "description": "URL or JSON object for the JSON-LD Context that defines the schema used"
    },
    "@id": {
      "title": "Metadata Catalog ID",
      "description": "IRI for the JSON-LD Node Identifier of the Catalog. This should be the URL of the data.json file itself.",
      "type": "string",
      "format": "uri"
    },
    "@type": {
      "title": "Metadata Context",
      "description": "IRI for the JSON-LD data type. This should be dcat:Catalog for the Catalog",
      "enum": [
        "dcat:Catalog",
        "Catalog"
      ]
    },
    "conformsTo": {
      "description": "Version of Schema",
      "title": "Version of Schema",
      "enum": [
        "https://project-open-data.cio.gov/v1.1/schema"
      ]
    },
    "describedBy": {
      "description": "URL for the JSON Schema file that defines the schema used",
      "title": "Data Dictionary",
      "type": "string",
      "format": "uri"
    },
    "dataset": {
      "type": "array",
      "items": {
        "$ref": "dataset.json",
        "minItems": 1,
        "uniqueItems": true
      }
    },
    "modified": {
      "title": "Last Update",
      "description": "Most recent date on which the catalog was changed, updated or modified.",
      "anyOf": [
        {
          "type": "string",
          "pattern": "^([\\+-]?\\d{4}(?!\\d{2}\\b))((-?)((0[1-9]|1[0-2])(\\3([12]\\d|0[1-9]|3[01]))?|W([0-4]\\d|5[0-2])(-?[1-7])?|(00[1-9]|0[1-9]\\d|[12]\\d{2}|3([0-5]\\d|6[1-6])))([T\\s]((([01]\\d|2[0-3])((:?)[0-5]\\d)?|24\\:?00)([\\.,]\\d+(?!:))?)?(\\17[0-5]\\d([\\.,]\\d+)?)?([zZ]|([\\+-])([01]\\d|2[0-3]):?([0-5]\\d)?)?)?)?$"
        },
        {
          "type": "string",
          "pattern": "^(R\\d*\\/)?P(?:\\d+(?:\\.\\d+)?Y)?(?:\\d+(?:\\.\\d+)?M)?(?:\\d+(?:\\.\\d+)?W)?(?:\\d+(?:\\.\\d+)?D)?(?:T(?:\\d+(?:\\.\\d+)?H)?(?:\\d+(?:\\.\\d+)?M)?(?:\\d+(?:\\.\\d+)?S)?)?$"
        },
        {
          "type": "string",
          "pattern": "^(R\\d*\\/)?([\\+-]?\\d{4}(?!\\d{2}\\b))((-?)((0[1-9]|1[0-2])(\\4([12]\\d|0[1-9]|3[01]))?|W([0-4]\\d|5[0-2])(-?[1-7])?|(00[1-9]|0[1-9]\\d|[12]\\d{2}|3([0-5]\\d|6[1-6])))([T\\s]((([01]\\d|2[0-3])((:?)[0-5]\\d)?|24\\:?00)([\\.,]\\d+(?!:))?)?(\\18[0-5]\\d([\\.,]\\d+)?)?([zZ]|([\\+-])([01]\\d|2[0-3]):?([0-5]\\d)?)?)?)?(\\/)P(?:\\d+(?:\\.\\d+)?Y)?(?:\\d+(?:\\.\\d+)?M)?(?:\\d+(?:\\.\\d+)?W)?(?:\\d+(?:\\.\\d+)?D)?(?:T(?:\\d+(?:\\.\\d+)?H)?(?:\\d+(?:\\.\\d+)?M)?(?:\\d+(?:\\.\\d+)?S)?)?$"
        }
      ]
    },
    "description": {
      "title": "Description",
      "type": "string",
      "minLength": 1
    }
  }
}